<?xml version="1.0" encoding="UTF-8"?>
<Persons xmlns:xsi="http://www.w3.org/2001/XMLSchema-instance"
        xsi:schemaLocation="http://jd02_09.karpeichyk.it.by Persons.xsd"
        xmlns="http://jd02_09.karpeichyk.it.by">

        <Person>
            <Email>lorry@fraht.com</Email>
            <Nickname>GrazyDriver</Nickname>
            <Password>h879586k</Password>
            <Ads>
                <Ad>
                    <Description>
                        Грузоперевозки по Рб и РФ
                    </Description>
                    <Carrying>20</Carrying>
                    <Volume>120</Volume>
                    <Tariff>1.5$ за километр</Tariff>
                </Ad>
                <Ad>
                    <Description>
                        Грузоперевозки по Рб
                    </Description>
                    <Carrying>5</Carrying>
                    <Volume>50</Volume>
                    <Tariff>0.75$ за километр</Tariff>
                </Ad>
            </Ads>

        </Person>
        <Person>
            <Email>truck@fraht.com</Email>
            <Nickname>NorthDriver</Nickname>
            <Password>78o52i89</Password>
            <Ads>
                <Ad>
                    <Description>
                        Грузоперевозки по Европе
                    </Description>
                    <Carrying>20</Carrying>
                    <Volume>120</Volume>
                    <Tariff>1.65$ за километр</Tariff>
                </Ad>
                <Ad>
                    <Description>
                        Грузоперевозки по Рб и РФ
                    </Description>
                    <Carrying>10</Carrying>
                    <Volume>80</Volume>
                    <Tariff>0.95$ за километр</Tariff>
                </Ad>
            </Ads>

        </Person>

</Persons>
